price_in_rp,district,city,lat,long,facilities,property_type,ads_id,bedrooms,bathrooms,land_size_m2,building_size_m2,carports,certificate,electricity,maid_bedrooms,maid_bathrooms,floors,year_built,property_condition,building_orientation,garages,furnishing
4270000000.0,Alam Sutera, Tangerang,-6.2623791,106.5220235," Jogging Track,  Taman, Kolam Renang, CCTV, Jalur Telepon, Taman, Keamanan, Keamanan 24 jam, Ac, AC,  CCTV, Track Lari,  Kolam Renang,  Jalur Telepon",rumah,hos10799706,4.0,3.0,200.0,155.0,2.0,shm - sertifikat hak milik,2200.0,1.0,1.0,2.0,2020.0,baru,selatan,2.0,semi furnished
3830000000.0,Alam Sutera, Tangerang,-6.2623791,106.5220235," Keamanan, CCTV, Akses Parkir, Wastafel,  Track Lari, Keamanan 24 jam, Ac,  CCTV,  AC,  Lapangan Voli,  Jogging Track, Lapangan Tenis,  Pemanas Air, Kitchen Set,  Playground,  Taman, Lapangan Basket, Tempat Jemuran,  Lapangan Bulu Tangkis, Taman,  One Gate System",rumah,hos11262094,3.0,3.0,105.0,135.0,1.0,shm - sertifikat hak milik,3500.0,0.0,1.0,2.0,2022.0,baru,selatan,2.0,furnished
1320000000.0,Alam Sutera, Tangerang,-6.2623791,106.5220235,"Keamanan, Taman",rumah,hos10364478,6.0,2.0,91.0,170.0,1.0,,2200.0,0.0,0.0,2.0,,,,1.0,unfurnished
5860000000.0,Alam Sutera, Tangerang,-6.2623791,106.5220235," Ac,  Lapangan Voli,  Jogging Track,  Taman, Lapangan Tenis,  Pemanas Air, Tempat Jemuran, Jalur Telepon, Lapangan Basket, Keamanan, Kitchen Set,  Lapangan Bulu Tangkis,  Track Lari, Wastafel,  CCTV, Taman,  AC,  Jalur Telepon",rumah,hos11191943,4.0,4.0,160.0,209.0,1.0,shm - sertifikat hak milik,3500.0,0.0,0.0,2.0,2022.0,baru,utara,2.0,semi furnished
3830000000.0,Alam Sutera, Tangerang,-6.2623791,106.5220235," Keamanan, Jalur Telepon, Akses Parkir, Wastafel,  Track Lari, Keamanan 24 jam, Ac,  CCTV,  AC,  Lapangan Voli, Lapangan Tenis,  Pemanas Air, Kitchen Set,  Playground,  Taman, Jogging Track,  Lapangan Bulu Tangkis, Tempat Jemuran, Lapangan Basket,  One Gate System,  Jalur Telepon",rumah,hos11186986,3.0,3.0,105.0,135.0,1.0,shm - sertifikat hak milik,3500.0,0.0,1.0,2.0,2022.0,baru,selatan,2.0,semi furnished
5050000000.0,Alam Sutera, Tangerang,-6.2623791,106.5220235," Lapangan Voli,  Keamanan, CCTV,  Jogging Track,  Taman, Lapangan Tenis,  Pemanas Air, Tempat Jemuran, Jalur Telepon, Lapangan Basket, Kitchen Set,  Track Lari, Ac, Wastafel,  CCTV,  AC,  Jalur Telepon",rumah,hos11186921,4.0,3.0,140.0,176.0,1.0,shm - sertifikat hak milik,3500.0,1.0,1.0,2.0,2022.0,baru,utara,2.0,semi furnished
3830000000.0,Alam Sutera, Tangerang,-6.2623791,106.5220235," Keamanan, CCTV, Jalur Telepon, Wastafel,  Kolam Renang,  Track Lari, Keamanan 24 jam, Ac,  CCTV,  AC,  Jogging Track, Lapangan Tenis,  Pemanas Air, Kitchen Set,  Playground,  Taman,  Tempat Gym, Lapangan Basket, Taman,  One Gate System,  Tempat Laundry,  Jalur Telepon",rumah,hos11129974,3.0,2.0,105.0,134.0,2.0,shm - sertifikat hak milik,3500.0,1.0,1.0,2.0,2022.0,baru,selatan,0.0,semi furnished
5050000000.0,Alam Sutera, Tangerang,-6.2623791,106.5220235," Ac,  Lapangan Voli,  Jogging Track,  Tempat Gym, Lapangan Tenis,  Pemanas Air, Lapangan Basket, Taman, Jalur Telepon, Keamanan, Kitchen Set,  Track Lari, Wastafel,  CCTV,  Kolam Renang,  AC,  Jalur Telepon",rumah,hos11129948,4.0,3.0,140.0,176.0,2.0,shm - sertifikat hak milik,5500.0,1.0,1.0,1.0,2022.0,baru,utara,0.0,semi furnished
5860000000.0,Alam Sutera, Tangerang,-6.2623791,106.5220235," Ac,  Lapangan Voli,  Keamanan,  Jogging Track,  Tempat Gym, Lapangan Tenis, Lapangan Basket, Jalur Telepon, Kitchen Set,  Track Lari, Wastafel,  CCTV,  Kolam Renang,  AC, Taman",rumah,hos11129916,4.0,3.0,160.0,209.0,0.0,shm - sertifikat hak milik,3500.0,1.0,1.0,1.0,2022.0,baru,,0.0,semi furnished
1200000000.0,Alam Sutera, Tangerang,-6.2623791,106.5220235," Keamanan,  Jogging Track, Kolam Renang,  Masjid,  CCTV, Taman",rumah,hos9677363,2.0,1.0,50.0,63.0,1.0,shm - sertifikat hak milik,2200.0,0.0,0.0,2.0,2022.0,baru,selatan,0.0,
10200000000.0,Alam Sutera, Tangerang,-6.2623791,106.5220235," Jogging Track,  Taman, Keamanan, Ac,  Kolam Renang",rumah,hos9873425,4.0,4.0,350.0,750.0,2.0,shm - sertifikat hak milik,6600.0,1.0,1.0,1.0,2010.0,bagus,barat,2.0,
6630000000.0,Alam Sutera, Tangerang,-6.2623791,106.5220235," Keamanan, CCTV,  Jogging Track,  Taman, Jalur Telepon,  Kolam Renang",rumah,hos10769265,4.0,4.0,205.0,241.0,3.0,shm - sertifikat hak milik,3500.0,1.0,1.0,3.0,2022.0,baru,barat laut,0.0,furnished
4980000000.0,Alam Sutera, Tangerang,-6.2623791,106.5220235," Ac,  Keamanan, Kolam Renang,  Taman, CCTV, Jogging Track, Jalur Telepon, AC,  CCTV, Track Lari,  Jalur Telepon",rumah,hos7564996,5.0,4.0,200.0,193.0,2.0,shm - sertifikat hak milik,2200.0,2.0,1.0,2.0,2021.0,baru,timur,4.0,semi furnished
3190000000.0,Alam Sutera, Tangerang,-6.2623791,106.5220235," Ac,  Keamanan, CCTV,  Jogging Track, Kolam Renang,  Taman, AC, Track Lari, Taman",rumah,hos10149374,3.0,2.0,128.0,138.0,2.0,shm - sertifikat hak milik,2200.0,1.0,1.0,2.0,2021.0,,timur,2.0,semi furnished
4270000000.0,Alam Sutera, Tangerang,-6.2623791,106.5220235," Keamanan,  Jogging Track, Kolam Renang,  Taman, CCTV, Taman, Jalur Telepon, AC, Ac,  CCTV, Track Lari,  Kolam Renang,  Jalur Telepon",rumah,hos3691220,6.0,7.0,200.0,155.0,2.0,shm - sertifikat hak milik,2200.0,1.0,1.0,2.0,2020.0,baru,timur,2.0,semi furnished
5860000000.0,Alam Sutera, Tangerang,-6.2623791,106.5220235," Keamanan, CCTV, Jalur Telepon, Akses Parkir, Wastafel,  Track Lari, Keamanan 24 jam, Ac,  CCTV,  AC,  Lapangan Voli,  Jogging Track, Lapangan Tenis,  Pemanas Air, Kitchen Set,  Playground,  Taman, Lapangan Basket, Tempat Jemuran,  Lapangan Bulu Tangkis,  One Gate System,  Jalur Telepon",rumah,hos11183387,4.0,3.0,160.0,209.0,1.0,shm - sertifikat hak milik,3500.0,1.0,1.0,1.0,2022.0,baru,utara,2.0,semi furnished
3830000000.0,Alam Sutera, Tangerang,-6.2623791,106.5220235," Keamanan, CCTV,  Taman, Jalur Telepon, Keamanan 24 jam, Ac, AC, Taman,  Jalur Telepon",rumah,hos11116165,2.0,2.0,105.0,134.0,2.0,"lainnya (ppjb,girik,adat,dll)",3500.0,0.0,0.0,2.0,2022.0,baru,utara,0.0,semi furnished
3830000000.0,Alam Sutera, Tangerang,-6.2623791,106.5220235," Keamanan,  Jogging Track, CCTV, AC, Ac,  CCTV, Track Lari,  Kolam Renang, Taman",rumah,hos11316415,3.0,3.0,105.0,135.0,1.0,shm - sertifikat hak milik,3500.0,0.0,1.0,2.0,2022.0,baru,selatan,0.0,semi furnished
1200000000.0,Alam Sutera, Tangerang,-6.2623791,106.5220235,"Keamanan, Taman",rumah,hos10933378,3.0,2.0,80.0,80.0,1.0,shm - sertifikat hak milik,1300.0,0.0,0.0,2.0,,bagus,,0.0,unfurnished
1320000000.0,Alam Sutera, Tangerang,-6.2623791,106.5220235,"Keamanan, Taman",rumah,hos10613097,6.0,2.0,91.0,170.0,0.0,hgb - hak guna bangunan,2200.0,0.0,0.0,2.0,,,,1.0,unfurnished
1800000000.0,Alam Sutera, Tangerang,-6.2623791,106.5220235,"Keamanan, Taman",rumah,hos10613180,3.0,2.0,144.0,180.0,0.0,shm - sertifikat hak milik,2200.0,0.0,0.0,1.0,,bagus,,1.0,unfurnished
1530000000.0,Alam Sutera, Tangerang,-6.2623791,106.5220235,"Keamanan, Taman",rumah,hos10733219,2.0,2.0,90.0,95.0,1.0,shm - sertifikat hak milik,2200.0,0.0,0.0,2.0,,bagus,,0.0,unfurnished
9400000000.0,Alam Sutera, Tangerang,-6.2623791,106.5220235," Jogging Track, Kolam Renang, Ac,  Keamanan",rumah,hos10900188,5.0,6.0,300.0,700.0,6.0,"lainnya (ppjb,girik,adat,dll)",5500.0,2.0,1.0,3.0,2020.0,bagus sekali,barat laut,0.0,semi furnished
6660000000.0,Alam Sutera, Tangerang,-6.2623791,106.5220235," Keamanan, CCTV,  Jogging Track,  Taman, Keamanan 24 jam, Ac, AC, Track Lari,  Kolam Renang, Taman",rumah,hos10882274,5.0,4.0,144.0,277.0,1.0,shm - sertifikat hak milik,5500.0,1.0,1.0,3.0,2022.0,baru,timur,0.0,semi furnished
2690000000.0,Alam Sutera, Tangerang,-6.2623791,106.5220235," Keamanan,  Taman,  Jogging Track, Tempat Jemuran, Jalur Telepon, Akses Parkir, Kitchen Set, Keamanan 24 jam, Ac, Wastafel,  CCTV, Track Lari,  One Gate System,  AC,  Playground",rumah,hos11155910,3.0,2.0,170.0,110.0,1.0,shm - sertifikat hak milik,2200.0,1.0,1.0,2.0,2010.0,bagus,utara,1.0,semi furnished
3190000000.0,Alam Sutera, Tangerang,-6.2623791,106.5220235," Keamanan,  Jogging Track, Kolam Renang,  Taman, Ac,  CCTV",rumah,hos11108462,3.0,2.0,124.0,138.0,1.0,shm - sertifikat hak milik,3300.0,1.0,1.0,2.0,2022.0,baru,selatan,2.0,semi furnished
3500000000.0,Alam Sutera, Tangerang,-6.2623791,106.5220235," Jogging Track, Taman, Ac,  Keamanan",rumah,hos11104072,3.0,3.0,144.0,200.0,2.0,shm - sertifikat hak milik,2200.0,1.0,1.0,2.0,2019.0,bagus sekali,barat,0.0,semi furnished
2600000000.0,Alam Sutera, Tangerang,-6.2623791,106.5220235,"Keamanan, Taman",rumah,hos10719998,4.0,3.0,117.0,177.0,1.0,shm - sertifikat hak milik,3500.0,1.0,0.0,2.0,,bagus,,0.0,unfurnished
3830000000.0,Alam Sutera, Tangerang,-6.2623791,106.5220235," Keamanan,  Jogging Track, CCTV, AC, Ac,  CCTV, Track Lari,  Kolam Renang, Taman",rumah,hos11105264,3.0,3.0,105.0,134.0,1.0,shm - sertifikat hak milik,3500.0,0.0,0.0,2.0,2022.0,baru,selatan,0.0,semi furnished
4980000000.0,Alam Sutera, Tangerang,-6.2623791,106.5220235," Ac,  Taman, Jogging Track, Keamanan,  CCTV,  Kolam Renang,  Jalur Telepon",rumah,hos11101911,4.0,3.0,200.0,193.0,2.0,shm - sertifikat hak milik,2200.0,1.0,1.0,2.0,2021.0,baru,selatan,0.0,semi furnished
4270000000.0,Alam Sutera, Tangerang,-6.2623791,106.5220235," Keamanan, Kolam Renang,  Taman, Jogging Track,  CCTV,  AC,  Jalur Telepon",rumah,hos10248223,4.0,3.0,200.0,155.0,2.0,shm - sertifikat hak milik,2200.0,1.0,1.0,2.0,2021.0,baru,timur,0.0,semi furnished
12400000000.0,Alam Sutera, Tangerang,-6.2623791,106.5220235," Keamanan, CCTV,  Jogging Track, Track Lari,  Kolam Renang, Taman",rumah,hos9891081,5.0,4.0,320.0,390.0,3.0,shm - sertifikat hak milik,5500.0,1.0,1.0,3.0,2021.0,bagus sekali,tenggara,0.0,unfurnished
5350000000.0,Alam Sutera, Tangerang,-6.2623791,106.5220235," Ac,  Keamanan, Kolam Renang,  Taman, CCTV, Jogging Track, Taman, Jalur Telepon, Keamanan 24 jam, AC,  CCTV, Track Lari,  Kolam Renang,  Jalur Telepon",rumah,hos6914800,6.0,6.0,126.0,231.0,0.0,shm - sertifikat hak milik,3500.0,1.0,1.0,3.0,2020.0,baru,tenggara,2.0,furnished
6660000000.0,Alam Sutera, Tangerang,-6.2623791,106.5220235," Ac,  Keamanan,  Jogging Track, Kolam Renang,  Pemanas Air, Tempat Jemuran, Lapangan Basket, Kitchen Set, Wastafel,  CCTV, Track Lari, Taman,  AC",rumah,hos11229613,5.0,4.0,144.0,277.0,1.0,shm - sertifikat hak milik,5500.0,0.0,1.0,3.0,2022.0,baru,selatan,2.0,semi furnished
2800000000.0,Alam Sutera, Tangerang,-6.2623791,106.5220235,"Keamanan, Taman",rumah,hos10612484,4.0,4.0,157.0,270.0,0.0,shm - sertifikat hak milik,4400.0,0.0,0.0,2.0,,bagus,,1.0,unfurnished
26000000000.0,Alam Sutera, Tangerang,-6.2623791,106.5220235," Mesin Cuci, Kulkas,  Kitchen Set, CCTV,  Taman,  Pemanas Air, Ac, Wastafel,  CCTV, Taman,  AC",rumah,hos11225675,,,765.0,650.0,3.0,shm - sertifikat hak milik,10600.0,0.0,0.0,2.0,2018.0,bagus,utara,2.0,
10200000000.0,Alam Sutera, Tangerang,-6.2623791,106.5220235,Kolam Renang,rumah,hos8837622,5.0,5.0,350.0,750.0,0.0,,2200.0,1.0,1.0,2.0,2018.0,bagus sekali,,0.0,
8820000000.0,Alam Sutera, Tangerang,-6.2623791,106.5220235," Ac,  Keamanan, CCTV,  Jogging Track, Kolam Renang,  Taman,  Pemanas Air, Tempat Jemuran, Lapangan Basket, Kitchen Set, Wastafel,  CCTV, Track Lari,  AC",rumah,hos11156216,5.0,4.0,215.0,287.0,1.0,shm - sertifikat hak milik,5500.0,0.0,1.0,3.0,2022.0,baru,barat daya,3.0,semi furnished
4440000000.0,Alam Sutera, Tangerang,-6.2623791,106.5220235," Ac,  Keamanan, CCTV,  Taman, Jogging Track, Tempat Jemuran, Jalur Telepon,  Pemanas Air, Lapangan Basket, Kitchen Set, Wastafel,  CCTV, Track Lari,  Kolam Renang,  AC,  Jalur Telepon",rumah,hos11154864,4.0,3.0,108.0,195.0,1.0,shm - sertifikat hak milik,3500.0,0.0,1.0,3.0,2022.0,baru,tenggara,2.0,semi furnished
13800000000.0,Alam Sutera, Tangerang,-6.2623791,106.5220235,"Tempat Gym,  Taman, Tempat Jemuran, Jalur Telepon, Akses Parkir, Kitchen Set, Keamanan 24 jam, Wastafel,  CCTV, Track Lari,  Kolam Renang,  One Gate System,  AC,  Playground",rumah,hos11154559,6.0,7.0,473.0,705.0,2.0,shm - sertifikat hak milik,13200.0,1.0,1.0,1.0,2021.0,baru,timur,2.0,semi furnished
4440000000.0,Alam Sutera, Tangerang,-6.2623791,106.5220235," Ac,  Keamanan,  Jogging Track, Kolam Renang,  Taman, CCTV, Jalur Telepon, Keamanan 24 jam, AC,  CCTV, Track Lari,  Kolam Renang, Taman",rumah,hos6445366,5.0,4.0,108.0,195.0,2.0,shm - sertifikat hak milik,3500.0,1.0,1.0,2.0,2022.0,baru,timur,4.0,semi furnished
6660000000.0,Alam Sutera, Tangerang,-6.2623791,106.5220235," Ac,  Keamanan,  Jogging Track, Kolam Renang,  Taman,  Pemanas Air, Tempat Jemuran, Jalur Telepon, Lapangan Basket, Kitchen Set, Wastafel,  CCTV, Track Lari,  Kolam Renang,  AC",rumah,hos11151510,5.0,4.0,144.0,277.0,1.0,shm - sertifikat hak milik,5500.0,1.0,1.0,3.0,2021.0,baru,selatan,2.0,semi furnished
3830000000.0,Alam Sutera, Tangerang,-6.2623791,106.5220235," Keamanan, CCTV,  Jogging Track,  Taman, Kolam Renang, Jalur Telepon, Taman, Keamanan 24 jam, Ac, AC, Track Lari,  Kolam Renang,  Jalur Telepon",rumah,hos7765800,5.0,4.0,105.0,135.0,2.0,shm - sertifikat hak milik,2200.0,1.0,1.0,2.0,2021.0,baru,selatan,4.0,semi furnished
7670000000.0,Alam Sutera, Tangerang,-6.2623791,106.5220235,"Jalur Telepon, Taman, AC",rumah,hos11064248,4.0,4.0,230.0,540.0,2.0,,2200.0,1.0,1.0,2.0,,bagus,utara,2.0,
1860000000.0,Alam Sutera, Tangerang,-6.2623791,106.5220235,"Keamanan, Taman",rumah,hos10388730,3.0,3.0,144.0,100.0,1.0,shm - sertifikat hak milik,2200.0,0.0,0.0,1.0,,bagus,,1.0,unfurnished
1680000000.0,Alam Sutera, Tangerang,-6.2623791,106.5220235,"Keamanan, Taman",rumah,hos10183993,3.0,2.0,76.0,67.0,1.0,shm - sertifikat hak milik,2200.0,0.0,0.0,2.0,,,,1.0,unfurnished
3190000000.0,Alam Sutera, Tangerang,-6.2623791,106.5220235," Keamanan, CCTV,  Jogging Track,  Taman, Ac,  Kolam Renang",rumah,hos11095334,3.0,2.0,124.0,138.0,1.0,shm - sertifikat hak milik,3500.0,1.0,1.0,2.0,2022.0,baru,utara,0.0,semi furnished
4270000000.0,Alam Sutera, Tangerang,-6.2623791,106.5220235," Keamanan,  Jogging Track, Kolam Renang,  Taman, Ac,  CCTV",rumah,hos11095428,4.0,3.0,200.0,155.0,1.0,shm - sertifikat hak milik,3500.0,1.0,1.0,2.0,2022.0,baru,selatan,1.0,semi furnished
3760000000.0,Alam Sutera, Tangerang,-6.2623791,106.5220235," Keamanan, Jalur Telepon, Akses Parkir, Wastafel, Taman,  Track Lari, Keamanan 24 jam,  CCTV,  AC,  Jogging Track, Kolam Renang, Lapangan Tenis,  Pemanas Air, Kitchen Set,  Playground,  Taman, Lapangan Basket, Tempat Jemuran,  Kolam Renang,  One Gate System,  Tempat Laundry,  Jalur Telepon",rumah,hos10316089,3.0,3.0,105.0,134.0,2.0,shm - sertifikat hak milik,2200.0,1.0,1.0,2.0,2022.0,baru,selatan,0.0,semi furnished
960000000.0,Alam Sutera, Tangerang,-6.2623791,106.5220235,"Keamanan, Taman",rumah,hos10542785,3.0,1.0,103.0,90.0,1.0,shm - sertifikat hak milik,1300.0,0.0,0.0,1.0,,,,1.0,unfurnished
5050000000.0,Alam Sutera, Tangerang,-6.2623791,106.5220235," Ac,  Taman, Lapangan Tenis, Jogging Track,  Pemanas Air, Lapangan Basket, Keamanan, Kitchen Set,  Track Lari, Wastafel,  CCTV,  Kolam Renang,  AC, Taman",rumah,hos11146107,4.0,3.0,140.0,176.0,1.0,shm - sertifikat hak milik,3500.0,0.0,1.0,2.0,2022.0,baru,utara,2.0,semi furnished
6660000000.0,Alam Sutera, Tangerang,-6.2623791,106.5220235," Keamanan,  Jogging Track, CCTV, AC, Ac,  CCTV, Track Lari,  Kolam Renang, Taman",rumah,hos11146003,5.0,4.0,144.0,277.0,1.0,shm - sertifikat hak milik,5500.0,1.0,1.0,3.0,2022.0,baru,selatan,2.0,semi furnished
3710000000.0,Alam Sutera, Tangerang,-6.2623791,106.5220235,"Kolam Renang,  Taman, CCTV, Jalur Telepon, AC, Ac,  Kolam Renang,  CCTV, Taman,  Jalur Telepon",rumah,hos5960646,5.0,4.0,105.0,134.0,0.0,shm - sertifikat hak milik,2200.0,0.0,0.0,2.0,2022.0,baru,selatan,2.0,semi furnished
3190000000.0,Alam Sutera, Tangerang,-6.2623791,106.5220235," Jogging Track,  Taman, Kolam Renang, CCTV, Jalur Telepon, Keamanan, AC, Ac,  CCTV, Track Lari,  Kolam Renang,  Jalur Telepon",rumah,hos7851253,4.0,4.0,124.0,138.0,2.0,shm - sertifikat hak milik,2200.0,1.0,1.0,2.0,2020.0,baru,timur,3.0,semi furnished
5100000000.0,Alam Sutera, Tangerang,-6.2623791,106.5220235," Ac,  Jogging Track, Kolam Renang,  Taman, CCTV, Jalur Telepon, Keamanan, AC,  CCTV, Track Lari,  Jalur Telepon",rumah,hos10894569,4.0,5.0,205.0,183.0,2.0,"lainnya (ppjb,girik,adat,dll)",5500.0,1.0,1.0,2.0,2021.0,baru,timur,5.0,furnished
3250000000.0,Alam Sutera, Tangerang,-6.2623791,106.5220235,"Jalur Telepon, Taman,  One Gate System, Keamanan 24 jam",rumah,hos11086486,3.0,2.0,200.0,160.0,0.0,shm - sertifikat hak milik,4400.0,1.0,1.0,1.0,,baru,,0.0,unfurnished
8330000000.0,Alam Sutera, Tangerang,-6.2623791,106.5220235," Ac,  Keamanan,  Jogging Track, Kolam Renang,  CCTV, Taman,  Jalur Telepon",rumah,hos10470335,5.0,4.0,144.0,277.0,2.0,,10000.0,1.0,1.0,3.0,2021.0,baru,timur,0.0,furnished
6650000000.0,Alam Sutera, Tangerang,-6.2623791,106.5220235," Keamanan,  Jogging Track, Taman, AC,  CCTV,  Kolam Renang,  Jalur Telepon",rumah,hos10757342,4.0,4.0,200.0,250.0,2.0,"lainnya (ppjb,girik,adat,dll)",5500.0,1.0,1.0,2.0,2021.0,baru,barat laut,0.0,furnished
5350000000.0,Alam Sutera, Tangerang,-6.2623791,106.5220235," Ac,  Keamanan, CCTV,  Jogging Track,  Taman, Jalur Telepon,  Kolam Renang",rumah,hos8621797,4.0,3.0,126.0,231.0,1.0,shm - sertifikat hak milik,3500.0,1.0,1.0,3.0,2021.0,baru,timur laut,2.0,semi furnished
6660000000.0,Alam Sutera, Tangerang,-6.2623791,106.5220235," Ac,  Keamanan,  Jogging Track, CCTV, Jalur Telepon, Keamanan 24 jam, AC,  CCTV, Track Lari,  Kolam Renang, Taman",rumah,hos8621794,5.0,4.0,144.0,277.0,1.0,shm - sertifikat hak milik,5500.0,1.0,1.0,3.0,2021.0,baru,timur laut,2.0,semi furnished
8390000000.000001,Alam Sutera, Tangerang,-6.2623791,106.5220235," Keamanan, CCTV,  Jogging Track,  Taman, Ac,  Kolam Renang,  Jalur Telepon",rumah,hos8621801,5.0,4.0,198.0,287.0,2.0,shm - sertifikat hak milik,5500.0,1.0,1.0,3.0,2021.0,baru,tenggara,3.0,semi furnished
7500000000.0,Alam Sutera, Tangerang,-6.2623791,106.5220235," Ac,  Keamanan, Jalur Telepon, Keamanan 24 jam, AC,  Kolam Renang, Taman",rumah,hos11343775,4.0,4.0,240.0,450.0,0.0,shm - sertifikat hak milik,3500.0,1.0,1.0,1.0,2012.0,baru,selatan,0.0,furnished
3830000000.0,Alam Sutera, Tangerang,-6.2623791,106.5220235,"Masjid,  Jogging Track,  Taman, Kolam Renang, CCTV, Jalur Telepon, Keamanan, Keamanan 24 jam, Ac,  Masjid,  CCTV, AC, Track Lari,  Kolam Renang,  Jalur Telepon",rumah,hos11132054,3.0,3.0,105.0,134.0,2.0,shm - sertifikat hak milik,3500.0,1.0,1.0,2.0,2022.0,baru,utara,0.0,semi furnished
4440000000.0,Alam Sutera, Tangerang,-6.2623791,106.5220235,"Taman, Ac",rumah,hos7870841,5.0,4.0,108.0,195.0,0.0,shm - sertifikat hak milik,2200.0,1.0,1.0,3.0,2021.0,baru,,2.0,semi furnished
4500000000.0,Alam Sutera, Tangerang,-6.2623791,106.5220235,"Keamanan, Taman",rumah,hos11013749,4.0,3.0,200.0,240.0,2.0,shm - sertifikat hak milik,3300.0,0.0,0.0,2.0,2015.0,sudah renovasi,utara,0.0,semi furnished
5500000000.0,Alam Sutera, Tangerang,-6.2623791,106.5220235,"Jalur Telepon, Taman,  Keamanan",rumah,hos11039514,4.0,4.0,280.0,360.0,2.0,,4400.0,1.0,1.0,2.0,2015.0,bagus,selatan,2.0,semi furnished
3830000000.0,Alam Sutera, Tangerang,-6.2623791,106.5220235,"Akses Parkir, Wastafel, Taman,  Track Lari, Keamanan 24 jam,  CCTV,  Jogging Track, Kolam Renang, Lapangan Tenis, Kitchen Set,  Playground,  Taman, Lapangan Bola,  Tempat Gym,  Lapangan Bulu Tangkis, Keamanan,  Kolam Renang,  One Gate System,  Tempat Laundry,  Lapangan Basket",rumah,hos11314195,4.0,3.0,105.0,135.0,2.0,shm - sertifikat hak milik,2200.0,1.0,1.0,2.0,,baru,utara,0.0,semi furnished
3190000000.0,Alam Sutera, Tangerang,-6.2623791,106.5220235," Ac,  Keamanan, Kolam Renang,  Taman, Jogging Track,  CCTV,  Jalur Telepon",rumah,hos10243939,4.0,4.0,124.0,138.0,2.0,,3500.0,1.0,1.0,2.0,2021.0,baru,timur,0.0,semi furnished
8390000000.000001,Alam Sutera, Tangerang,-6.2623791,106.5220235," Ac,  Keamanan,  Jogging Track, Kolam Renang,  CCTV, Taman,  Jalur Telepon",rumah,hos10626513,5.0,4.0,198.0,287.0,3.0,,5500.0,1.0,1.0,3.0,2022.0,baru,timur laut,0.0,semi furnished
3830000000.0,Alam Sutera, Tangerang,-6.2623791,106.5220235," Keamanan, CCTV,  Jogging Track,  Taman, Keamanan 24 jam, Ac, AC, Track Lari,  Kolam Renang, Taman",rumah,hos11254489,3.0,3.0,105.0,135.0,1.0,shm - sertifikat hak milik,3500.0,0.0,1.0,2.0,2022.0,baru,selatan,0.0,semi furnished
5860000000.0,Alam Sutera, Tangerang,-6.2623791,106.5220235," Ac,  Keamanan,  Taman, Jogging Track, Jalur Telepon,  CCTV,  Kolam Renang",rumah,hos10642306,4.0,3.0,160.0,209.0,2.0,shm - sertifikat hak milik,4400.0,1.0,1.0,2.0,2022.0,baru,selatan,0.0,semi furnished
5050000000.0,Alam Sutera, Tangerang,-6.2623791,106.5220235," Keamanan,  Taman, Jogging Track, Ac,  CCTV,  Kolam Renang,  Jalur Telepon",rumah,hos10316697,4.0,3.0,140.0,176.0,2.0,shm - sertifikat hak milik,3500.0,1.0,1.0,2.0,2022.0,baru,timur,0.0,semi furnished
5000000000.0,Alam Sutera, Tangerang,-6.2623791,106.5220235," Ac, Keamanan,  Taman, Jogging Track",rumah,hos11113314,3.0,3.0,250.0,300.0,2.0,"lainnya (ppjb,girik,adat,dll)",3500.0,1.0,1.0,2.0,2017.0,bagus sekali,timur laut,0.0,semi furnished
2200000000.0,Alam Sutera, Tangerang,-6.2623791,106.5220235,"Keamanan, Taman",rumah,hos10404938,3.0,1.0,136.0,110.0,0.0,shm - sertifikat hak milik,2200.0,1.0,1.0,2.0,,bagus,selatan,2.0,unfurnished
2300000000.0,Alam Sutera, Tangerang,-6.2623791,106.5220235,"Kolam Renang, Taman,  Keamanan",rumah,hos9799496,3.0,2.0,102.0,125.0,1.0,shm - sertifikat hak milik,2200.0,0.0,0.0,2.0,2014.0,sudah renovasi,utara,0.0,unfurnished
2390000000.0,Alam Sutera, Tangerang,-6.2623791,106.5220235," Keamanan,  Jogging Track, Kolam Renang, Tempat Jemuran, Kitchen Set, Keamanan 24 jam,  Kolam Renang, Wastafel, Track Lari, Taman,  One Gate System",rumah,hos11144680,3.0,2.0,102.0,111.0,1.0,,3300.0,1.0,1.0,2.0,,bagus,selatan,0.0,semi furnished
7650000000.0,Alam Sutera, Tangerang,-6.2623791,106.5220235,Ac,rumah,hos10302598,4.0,3.0,224.0,340.0,3.0,,3500.0,1.0,1.0,2.0,2021.0,bagus,selatan,3.0,unfurnished
26000000000.0,Alam Sutera, Tangerang,-6.2623791,106.5220235," Jogging Track, Keamanan, Taman",rumah,hos10917216,4.0,4.0,763.0,650.0,2.0,,2200.0,2.0,1.0,2.0,,bagus,,0.0,furnished
3200000000.0,Alam Sutera, Tangerang,-6.2623791,106.5220235," Keamanan,  Jogging Track,  Taman, Kolam Renang, AC, Ac, Track Lari",rumah,hos11365197,3.0,3.0,152.0,140.0,2.0,shm - sertifikat hak milik,3500.0,1.0,1.0,2.0,,bagus,selatan,0.0,semi furnished
3800000000.0,Alam Sutera, Tangerang,-6.2623791,106.5220235," Ac,  Taman, Jogging Track, Jalur Telepon, Taman, Keamanan, Keamanan 24 jam, AC, Track Lari,  Kolam Renang,  Jalur Telepon",rumah,hos11365134,4.0,2.0,250.0,180.0,2.0,shm - sertifikat hak milik,2200.0,1.0,1.0,2.0,,bagus,utara,0.0,semi furnished
13800000000.0,Alam Sutera, Tangerang,-6.2623791,106.5220235," Keamanan, Kolam Renang, Kitchen Set, Keamanan 24 jam, Ac, AC,  One Gate System",rumah,hos11364379,6.0,7.0,473.0,705.0,4.0,shm - sertifikat hak milik,13200.0,1.0,1.0,3.0,,bagus,,2.0,
7500000000.0,Alam Sutera, Tangerang,-6.2623791,106.5220235," Keamanan,  Jogging Track, Lapangan Bola,  Tempat Gym, Lapangan Tenis,  Lapangan Bulu Tangkis, Jalur Telepon,  Track Lari, Keamanan 24 jam, Wastafel,  CCTV, Taman,  One Gate System,  Playground,  Lapangan Basket",rumah,hos11359578,4.0,4.0,240.0,460.0,1.0,shm - sertifikat hak milik,4400.0,1.0,1.0,2.0,2022.0,bagus,,1.0,furnished
2960000000.0,Gading Serpong, Tangerang,-6.2433511,106.6174456,"CCTV,  Kolam Renang, Taman,  Keamanan",rumah,hos11288769,4.0,3.0,96.0,116.0,2.0,"lainnya (ppjb,girik,adat,dll)",2200.0,1.0,1.0,2.0,2021.0,sudah renovasi,utara,0.0,unfurnished
5050000000.0,Gading Serpong, Tangerang,-6.2433511,106.6174456," Ac,  Lapangan Voli,  Jogging Track,  Taman, Lapangan Tenis,  Pemanas Air, Tempat Jemuran, Jalur Telepon, Lapangan Basket, Keamanan, Kitchen Set,  Lapangan Bulu Tangkis,  Track Lari, Wastafel,  CCTV,  AC",rumah,hos11283309,4.0,3.0,140.0,176.0,1.0,shm - sertifikat hak milik,3500.0,0.0,1.0,2.0,2022.0,baru,utara,2.0,semi furnished
7100000000.0,Gading Serpong, Tangerang,-6.2433511,106.6174456," Ac,  Taman, Jogging Track, Keamanan,  CCTV,  Kolam Renang,  Jalur Telepon",rumah,hos10472836,4.0,3.0,216.0,283.0,2.0,shm - sertifikat hak milik,5500.0,1.0,1.0,2.0,2022.0,baru,selatan,1.0,unfurnished
2700000000.0,Gading Serpong, Tangerang,-6.2433511,106.6174456," Keamanan, CCTV,  Jogging Track,  Taman, Kolam Renang, Jalur Telepon, Track Lari,  Kolam Renang",rumah,hos11133130,3.0,3.0,84.0,128.0,2.0,shm - sertifikat hak milik,2200.0,0.0,0.0,3.0,2022.0,bagus,selatan,2.0,furnished
1440000000.0,Gading Serpong, Tangerang,-6.2433511,106.6174456,"Keamanan, Taman",rumah,hos10612796,4.0,2.0,96.0,110.0,0.0,shm - sertifikat hak milik,2200.0,0.0,0.0,2.0,,bagus,,1.0,unfurnished
2400000000.0,Gading Serpong, Tangerang,-6.2433511,106.6174456,"Keamanan, Taman",rumah,hos10367477,3.0,2.0,161.0,200.0,1.0,shm - sertifikat hak milik,2200.0,1.0,0.0,2.0,,,,1.0,unfurnished
9000000000.0,Gading Serpong, Tangerang,-6.2433511,106.6174456," Jogging Track,  Taman, Keamanan, Ac,  CCTV,  Kolam Renang,  Jalur Telepon",rumah,hos11070003,5.0,6.0,414.0,840.0,4.0,"lainnya (ppjb,girik,adat,dll)",11000.0,3.0,1.0,3.0,2021.0,baru,selatan,0.0,semi furnished
7100000000.0,Gading Serpong, Tangerang,-6.2433511,106.6174456," Ac,  Taman, Jogging Track, Keamanan,  CCTV,  Kolam Renang,  Jalur Telepon",rumah,hos9813160,4.0,3.0,214.0,230.0,2.0,,5500.0,1.0,0.0,2.0,2022.0,baru,selatan,1.0,semi furnished
1060000000.0,Gading Serpong, Tangerang,-6.2433511,106.6174456,"Keamanan, Taman",rumah,hos10500609,4.0,3.0,106.0,151.0,1.0,shm - sertifikat hak milik,1300.0,0.0,0.0,2.0,,bagus,,1.0,unfurnished
2220000000.0,Gading Serpong, Tangerang,-6.2433511,106.6174456,"Keamanan, Taman",rumah,hos10613187,3.0,3.0,120.0,130.0,0.0,shm - sertifikat hak milik,2200.0,0.0,0.0,2.0,,bagus,,1.0,unfurnished
